[
  {
    "id": "add",
    "band": "koko",
    "grade": 3,
    "subject": "Maths",
    "title": "Adding with carrying",
    "kw": "add adding plus sum carry जोड़ जोड़ें जोड़ना दहाई इकाई 27 15 36 18",
    "text": "When the ones add up to 10 or more, write the ones digit and carry the ten to the tens column. Example: 27 + 15. Ones: 7 + 5 = 12, write 2 and carry 1. Tens: 2 + 1 + 1 = 4. So 27 + 15 = 42.",
    "answer": {
      "en": "Add the ones first: 7 + 5 = 12. Write 2 and carry 1 ten. Then add the tens: 2 + 1 + 1 = 4. So 27 + 15 = 42.",
      "hi": "पहले इकाई जोड़ो: 7 + 5 = 12। 2 लिखो और 1 दहाई हासिल लो। फिर दहाई जोड़ो: 2 + 1 + 1 = 4। इसलिए 27 + 15 = 42।"
    },
    "hints": {
      "en": [
        "Start with the ones place. What is 7 + 5?",
        "12 is more than 9. Write 2 and carry 1 ten. Now add the tens."
      ],
      "hi": [
        "इकाई से शुरू करो। 7 + 5 कितना होता है?",
        "12 में 2 लिखो और 1 दहाई हासिल लो। अब दहाई जोड़ो।"
      ]
    },
    "example": {
      "en": "Imagine counting rupees: 27 rupees plus 15 rupees makes 42 rupees.",
      "hi": "रुपयों से सोचो: 27 रुपये और 15 रुपये मिलाकर 42 रुपये होते हैं।"
    },
    "quiz": {
      "question": {
        "en": "What is 36 + 18?",
        "hi": "36 + 18 कितना है?"
      },
      "options": {
        "en": [
          "44",
          "54",
          "64"
        ],
        "hi": [
          "44",
          "54",
          "64"
        ]
      },
      "correct": 1
    },
    "activity": {
      "en": "Draw 36 dots and 18 dots. Circle groups of ten and count the remaining dots.",
      "hi": "36 और 18 बिंदु बनाओ। दस-दस के समूह घेरो और बचे बिंदु गिनो।"
    },
    "source": {
      "label": "Indigloo starter learning pack",
      "version": "1.0",
      "kind": "Original illustrative lesson; teacher review recommended"
    },
    "minutes": 5,
    "board": "CBSE",
    "review": {
      "status": "illustrative"
    }
  },
  {
    "id": "plant-food",
    "band": "koko",
    "grade": 4,
    "subject": "EVS",
    "title": "How plants get food",
    "kw": "plant food sunlight leaf leaves water पौधा भोजन धूप पत्ती पानी plants पौधे पाते",
    "text": "Green leaves make food for plants using sunlight, air and water absorbed by the roots. A plant kept in a dark cupboard for many days turns yellow and weak.",
    "answer": {
      "en": "A plant’s green leaves use sunlight, air and water from the roots to make food. Without light, the plant becomes weak.",
      "hi": "पौधे की हरी पत्तियाँ धूप, हवा और जड़ों से आए पानी से भोजन बनाती हैं। रोशनी न मिले तो पौधा कमज़ोर हो जाता है।"
    },
    "hints": {
      "en": [
        "What does a plant take in through its roots?",
        "What shines on the leaves and helps them make food?"
      ],
      "hi": [
        "पौधा जड़ों से क्या लेता है?",
        "पत्तियों पर क्या चमकता है और भोजन बनाने में मदद करता है?"
      ]
    },
    "example": {
      "en": "A leaf is like a tiny kitchen: sunlight is the energy, and air and water are ingredients.",
      "hi": "पत्ती एक छोटी रसोई जैसी है: धूप ऊर्जा है और हवा-पानी सामग्री हैं।"
    },
    "quiz": {
      "question": {
        "en": "Where does a plant make food?",
        "hi": "पौधा भोजन कहाँ बनाता है?"
      },
      "options": {
        "en": [
          "Green leaves",
          "Only roots",
          "Flowers only"
        ],
        "hi": [
          "हरी पत्तियाँ",
          "केवल जड़ें",
          "केवल फूल"
        ]
      },
      "correct": 0
    },
    "activity": {
      "en": "Draw a plant with arrows showing sunlight, air and water reaching its leaves.",
      "hi": "पौधा बनाओ और धूप, हवा तथा पानी के पत्तियों तक पहुँचने के तीर बनाओ।"
    },
    "source": {
      "label": "Indigloo starter learning pack",
      "version": "1.0",
      "kind": "Original illustrative lesson; teacher review recommended"
    },
    "minutes": 5,
    "board": "CBSE",
    "review": {
      "status": "illustrative"
    }
  },
  {
    "id": "fractions",
    "band": "koko",
    "grade": 4,
    "subject": "Maths",
    "title": "Halves and quarters",
    "kw": "half halves quarter fraction roti आधा चौथाई रोटी भिन्न ",
    "text": "Cut a roti into 2 equal parts and each part is one half. Cut it into 4 equal parts and each part is one quarter. Two quarters together make one half.",
    "answer": {
      "en": "Two equal pieces make halves. Four equal pieces make quarters. Two quarters together equal one half.",
      "hi": "दो बराबर हिस्से आधा बनाते हैं। चार बराबर हिस्से चौथाई बनाते हैं। दो चौथाई मिलकर आधा होते हैं।"
    },
    "hints": {
      "en": [
        "If you share a roti equally with one friend, how many pieces do you get?",
        "Now share it among four people. Is each piece bigger or smaller?"
      ],
      "hi": [
        "एक रोटी दोस्त के साथ बराबर बाँटोगे तो कितने हिस्से होंगे?",
        "अब चार लोगों में बाँटो। हर हिस्सा बड़ा होगा या छोटा?"
      ]
    },
    "example": {
      "en": "Fold a paper in half, then fold it again: you can see four quarters.",
      "hi": "काग़ज़ को आधा मोड़ो, फिर दोबारा मोड़ो: चार चौथाई दिखेंगे।"
    },
    "quiz": {
      "question": {
        "en": "Two quarters make…",
        "hi": "दो चौथाई मिलकर बनाते हैं…"
      },
      "options": {
        "en": [
          "One half",
          "One whole",
          "Three quarters"
        ],
        "hi": [
          "आधा",
          "पूरा",
          "तीन चौथाई"
        ]
      },
      "correct": 0
    },
    "activity": {
      "en": "Fold paper into four equal parts. Colour two parts. What fraction did you colour?",
      "hi": "काग़ज़ चार बराबर भागों में मोड़ो। दो भाग रंगो। कितनी भिन्न रंगी?"
    },
    "source": {
      "label": "Indigloo starter learning pack",
      "version": "1.0",
      "kind": "Original illustrative lesson; teacher review recommended"
    },
    "minutes": 5,
    "board": "CBSE",
    "review": {
      "status": "illustrative"
    }
  },
  {
    "id": "photosynthesis",
    "band": "nova",
    "grade": 7,
    "subject": "Science",
    "title": "Photosynthesis",
    "kw": "photosynthesis glucose chlorophyll stomata oxygen sunlight प्रकाश संश्लेषण क्लोरोफिल ऑक्सीजन plant plants food make पौधे पौधा भोजन बनाते बनाता",
    "text": "Green leaves contain chlorophyll, which traps energy from sunlight. The leaf combines carbon dioxide from air with water absorbed by roots to make glucose. Oxygen is released. Tiny pores called stomata let gases move in and out.",
    "answer": {
      "en": "Chlorophyll in leaves traps sunlight. The plant uses that energy to combine carbon dioxide from air with water from the roots, making glucose and releasing oxygen. Stomata are tiny pores that let gases move in and out.",
      "hi": "पत्तियों का क्लोरोफिल धूप की ऊर्जा पकड़ता है। पौधा हवा की कार्बन डाइऑक्साइड और जड़ों के पानी से ग्लूकोज़ बनाता है और ऑक्सीजन छोड़ता है। रंध्र पत्तियों के छोटे छिद्र हैं जिनसे गैसें आती-जाती हैं।"
    },
    "hints": {
      "en": [
        "What does a plant take from the air and soil?",
        "What does chlorophyll catch from sunlight?"
      ],
      "hi": [
        "पौधा हवा और मिट्टी से क्या लेता है?",
        "क्लोरोफिल धूप से क्या पकड़ता है?"
      ]
    },
    "example": {
      "en": "Think of a solar-powered kitchen: sunlight supplies energy, water and carbon dioxide are ingredients, and glucose is the food.",
      "hi": "सौर ऊर्जा वाली रसोई सोचो: धूप ऊर्जा देती है, पानी और कार्बन डाइऑक्साइड सामग्री हैं, और ग्लूकोज़ भोजन है।"
    },
    "quiz": {
      "question": {
        "en": "Which gas is released during photosynthesis?",
        "hi": "प्रकाश संश्लेषण में कौन-सी गैस निकलती है?"
      },
      "options": {
        "en": [
          "Carbon dioxide",
          "Oxygen",
          "Nitrogen"
        ],
        "hi": [
          "कार्बन डाइऑक्साइड",
          "ऑक्सीजन",
          "नाइट्रोजन"
        ]
      },
      "correct": 1
    },
    "activity": {
      "en": "Draw a leaf. Label carbon dioxide and water going in, and oxygen coming out.",
      "hi": "पत्ती बनाओ। अंदर जाते पानी और कार्बन डाइऑक्साइड तथा बाहर आती ऑक्सीजन को नाम दो।"
    },
    "source": {
      "label": "Indigloo starter learning pack",
      "version": "1.0",
      "kind": "Original illustrative lesson; teacher review recommended"
    },
    "minutes": 5,
    "board": "CBSE",
    "review": {
      "status": "illustrative"
    }
  },
  {
    "id": "green-leaves",
    "band": "nova",
    "grade": 7,
    "subject": "Science",
    "title": "Why leaves look green",
    "kw": "green colour color prism reflect light पत्ती हरी रंग रोशनी leaves हरी पत्तियाँ",
    "text": "Sunlight contains many colours. Chlorophyll absorbs mostly red and blue light and reflects green light. The reflected green light reaches our eyes, so leaves look green.",
    "answer": {
      "en": "Chlorophyll absorbs mostly red and blue light and reflects green light. That reflected light reaches our eyes, so leaves look green.",
      "hi": "क्लोरोफिल ज़्यादातर लाल और नीली रोशनी सोखता है और हरी रोशनी लौटाता है। यही रोशनी हमारी आँखों तक पहुँचती है, इसलिए पत्तियाँ हरी दिखती हैं।"
    },
    "hints": {
      "en": [
        "Sunlight contains many colours. What colour reaches your eyes from a leaf?",
        "Chlorophyll absorbs red and blue. What happens to green light?"
      ],
      "hi": [
        "धूप में कई रंग होते हैं। पत्ती से कौन-सा रंग आँखों तक पहुँचता है?",
        "क्लोरोफिल लाल और नीला सोखता है। हरी रोशनी का क्या होता है?"
      ]
    },
    "example": {
      "en": "A leaf is like a guest who keeps some colours of light and sends green back to you.",
      "hi": "पत्ती कुछ रंगों की रोशनी अपने पास रखती है और हरी रोशनी तुम्हारी ओर लौटाती है।"
    },
    "quiz": {
      "question": {
        "en": "Which light is mainly reflected by green leaves?",
        "hi": "हरी पत्तियाँ मुख्यतः कौन-सी रोशनी लौटाती हैं?"
      },
      "options": {
        "en": [
          "Red",
          "Blue",
          "Green"
        ],
        "hi": [
          "लाल",
          "नीली",
          "हरी"